{
  "schema_version": "1.1.0",
  "id": "forecast-evaluation.synthetic-single-case.v1",
  "registered_at": "2026-09-09T00:00:00Z",
  "claimed_registered_commit": "0000000",
  "registration_anchor": {
    "source": "https://example.org/forecast-evaluations/synthetic-single-case-v1",
    "retrieved_at": "2026-09-09T00:00:00Z",
    "vintage": "synthetic-registration-v1",
    "checksum": "sha256:aaaaaaaaaaaaaaaaaaaaaaaaaaaaaaaaaaaaaaaaaaaaaaaaaaaaaaaaaaaaaaaa",
    "verification_status": "unverified_external_review_required"
  },
  "cohort_policy": {
    "campaign_id": "campaign.synthetic-transition-2027",
    "registered_at": "2026-09-07T00:00:00Z",
    "eligibility_rule": {
      "kind": "all_issued_campaign_records",
      "campaign_id": "campaign.synthetic-transition-2027",
      "exclusions": "none"
    },
    "anchor": {
      "source": "https://example.org/forecast-evaluations/synthetic-cohort-policy-v1",
      "retrieved_at": "2026-09-07T00:00:00Z",
      "vintage": "synthetic-cohort-policy-v1",
      "checksum": "sha256:bbbbbbbbbbbbbbbbbbbbbbbbbbbbbbbbbbbbbbbbbbbbbbbbbbbbbbbbbbbbbbbb",
      "verification_status": "unverified_external_review_required"
    }
  },
  "eligible_registry_manifest": {
    "sealed_at": "2026-09-09T00:00:00Z",
    "eligible_forecast_ids": ["forecast.au-clerical-adoption.example.2027-q2.v1"],
    "source": "https://example.org/forecast-evaluations/synthetic-registry-manifest-v1",
    "retrieved_at": "2026-09-09T00:00:00Z",
    "vintage": "synthetic-registry-manifest-v1",
    "checksum": "sha256:cccccccccccccccccccccccccccccccccccccccccccccccccccccccccccccccc",
    "verification_status": "unverified_external_review_required"
  },
  "forecast_use_scope": ["research_only"],
  "cohort": [
    {
      "forecast_id": "forecast.au-clerical-adoption.example.2027-q2.v1",
      "issued_record_checksum": "sha256:e51028e81691f224f44ea4695d3a0ee1dabf78e2989d71d461125fa33279a598"
    }
  ],
  "scoring": {
    "primary": "brier",
    "secondary": ["log_loss"],
    "baseline_comparator": "campaign_mechanical_naive_and_reference_class"
  },
  "reliability": {
    "bin_edges": [0, 0.2, 0.4, 0.6, 0.8, 1],
    "minimum_resolved_forecasts": 30,
    "minimum_forecasts_per_bin": 5,
    "minimum_independent_clusters": 20,
    "minimum_independent_clusters_per_bin": 5,
    "small_n_handling": "withhold_rates_and_calibration_language"
  },
  "void_handling": {
    "cohort_denominator": "all_registered_forecasts",
    "scoring": "exclude_with_visible_disclosure",
    "adjudication_required": true,
    "minimum_score_coverage": 0.8
  },
  "declared_utility": {
    "comparator": "declared_no_model_policy",
    "aggregation": "stratify_by_utility_scale_consultation_and_adherence"
  },
  "registered_plan_checksum": "sha256:edf8ddc2ec7ca42b657a5796b99d539b2783b9bae616c58be50c5c80068d21a2"
}
